{
  "analysis": {
    "daily_coverage": {
      "complete": true,
      "expected_calendar_days": 31,
      "myd14a1_observed_days": 31,
      "vnp14a1_observed_days": 31
    },
    "end_date": "2023-03-31",
    "grid_version": "modis-viirs-sinusoidal-h26v06-926m-v1",
    "metric_id": "detected_active_land_cell_days_per_1000_valid_land_cell_days",
    "minimum_monthly_support_fraction": 0.5,
    "quality_policy_version": "firemask-qa-land-highnominal-v1",
    "reference_product_id": "myd14a1_061_aqua",
    "source_manifest_id": "src_c625a961eb1f",
    "source_manifest_sha256": "c625a961eb1fa91decafb64dd14d5adcf1d7ad1671a14df0674c521ef31ecd7d",
    "start_date": "2023-03-01"
  },
  "artifact_id": "art_science_aoi_sample_202303_r2_47c3e9751953",
  "calibration": null,
  "environment": {
    "dependency_lock_sha256": "5f974dd576e830551988b114a0680e1ef7070acf94e752c3b7360ae9e7989948",
    "operating_system": "Linux",
    "pipeline_revision": "science-sample-2023-03-v1",
    "python_version": "3.12.14"
  },
  "exclusions": [
    {
      "cell_days": 527325,
      "product_id": "myd14a1_061_aqua",
      "reason": "cloud"
    },
    {
      "cell_days": 341,
      "product_id": "myd14a1_061_aqua",
      "reason": "low_confidence_excluded"
    },
    {
      "cell_days": 36,
      "product_id": "myd14a1_061_aqua",
      "reason": "unknown"
    },
    {
      "cell_days": 42294,
      "product_id": "myd14a1_061_aqua",
      "reason": "water_or_non_land"
    },
    {
      "cell_days": 442381,
      "product_id": "vnp14a1_002_suomi_npp",
      "reason": "cloud"
    },
    {
      "cell_days": 111,
      "product_id": "vnp14a1_002_suomi_npp",
      "reason": "low_confidence_excluded"
    },
    {
      "cell_days": 2,
      "product_id": "vnp14a1_002_suomi_npp",
      "reason": "unknown"
    },
    {
      "cell_days": 43601,
      "product_id": "vnp14a1_002_suomi_npp",
      "reason": "water_or_non_land"
    }
  ],
  "files": [
    {
      "media_type": "application/json",
      "path": "analysis.json",
      "sha256": "5394cbfb9db20fd335977261f2107ab927a54b1af25bba9aa6e0b5cfa8cef4f7",
      "size_bytes": 5835
    },
    {
      "media_type": "text/csv",
      "path": "calendar.csv",
      "sha256": "401053e000651212f8e0e7c798b13a94619758ff32112dbf488f8fb520f3fcf1",
      "size_bytes": 531
    },
    {
      "media_type": "text/csv",
      "path": "block-month.csv",
      "sha256": "bdad84a81bc91bf0b18716837783b9bd3636a76a88035a9f9a7200779e28ce7a",
      "size_bytes": 319617
    },
    {
      "media_type": "application/json",
      "path": "evaluation.json",
      "sha256": "f4eabb3e84df50793eff0c67b1a6c746cd505a217e20f2286c74de77903f4716",
      "size_bytes": 241
    },
    {
      "media_type": "application/geo+json",
      "path": "region.geojson",
      "sha256": "96edf3b65a2f2a36609a0184ca7025744a6a5c0071997fcc05538e248d4bac4a",
      "size_bytes": 945
    },
    {
      "media_type": "text/html",
      "path": "monitoring-brief.html",
      "sha256": "7b81d301a6711cad3e73c25e46991dc9f4f763397680e025c55c7a5ca90665fe",
      "size_bytes": 161919
    }
  ],
  "limitations": [
    "Research sample only: native mask counts were decoded from the listed NASA granules for March 2023.",
    "The bounding box is a candidate analysis window inherited from the project; the team and local event have not frozen it.",
    "A daily cell is counted once per product composite. MYD14A1 is an eight-day file containing daily planes; VNP14A1 is daily.",
    "QA land cells define eligible support; clear land and nominal/high-confidence fire define valid support; nominal/high-confidence fire define detections.",
    "Low-confidence fire, water, cloud, unknown, and unprocessed cells are excluded from valid support and detections.",
    "The metric describes product detections, not independent fires, burned area, ignition probability, or fire danger.",
    "The two native sensor rates are not directly comparable; no transfer model, anomaly, interval, or priority score is released.",
    "Original local download timestamps were not retained; source file identity is established by filename, byte size, and SHA-256."
  ],
  "published_at": "2026-09-30T15:56:47.614500Z",
  "receipt_id": "rcpt_47c3e9751953",
  "region": {
    "bounds_wsen": [
      93.0,
      23.0,
      96.0,
      26.5
    ],
    "geometry_ref": "region.geojson",
    "geometry_sha256": "96edf3b65a2f2a36609a0184ca7025744a6a5c0071997fcc05538e248d4bac4a",
    "name": "Northeast India–Myanmar candidate window",
    "region_id": "region_ne_india_myanmar_candidate_r2",
    "revision": 2,
    "role": "science_pilot"
  },
  "schema_version": "1.0.0",
  "sources": [
    {
      "nominal_resolution_m": 1000,
      "platform": "Aqua",
      "product_guide_url": "https://www.earthdata.nasa.gov/s3fs-public/2023-09/MODIS_C6_C6.1_Fire_User_Guide_1.0.pdf",
      "product_id": "myd14a1_061_aqua",
      "provider_objects": [
        {
          "observed_end": "2023-03-05T23:59:59Z",
          "observed_start": "2023-02-26T00:00:00Z",
          "provider_checksum": null,
          "provider_object_id": "MYD14A1.A2023057.h26v06.061.2023070135900.hdf",
          "retrieval_timestamp_status": "not_recorded_for_local_copy",
          "retrieved_at": null,
          "sha256": "f573aee5442384485482f8a9f6bb4147f878a2cd704026172a9df49f4b09eb35",
          "size_bytes": 1205106,
          "source_url": "https://ladsweb.modaps.eosdis.nasa.gov/archive/allData/61/MYD14A1/2023/057/MYD14A1.A2023057.h26v06.061.2023070135900.hdf"
        },
        {
          "observed_end": "2023-03-13T23:59:59Z",
          "observed_start": "2023-03-06T00:00:00Z",
          "provider_checksum": null,
          "provider_object_id": "MYD14A1.A2023065.h26v06.061.2023074074609.hdf",
          "retrieval_timestamp_status": "not_recorded_for_local_copy",
          "retrieved_at": null,
          "sha256": "0477d956a7a035f64fe3df5776942ff602619c72129d52b41a80bd0bd3f27ae4",
          "size_bytes": 1442503,
          "source_url": "https://ladsweb.modaps.eosdis.nasa.gov/archive/allData/61/MYD14A1/2023/065/MYD14A1.A2023065.h26v06.061.2023074074609.hdf"
        },
        {
          "observed_end": "2023-03-21T23:59:59Z",
          "observed_start": "2023-03-14T00:00:00Z",
          "provider_checksum": null,
          "provider_object_id": "MYD14A1.A2023073.h26v06.061.2023082000920.hdf",
          "retrieval_timestamp_status": "not_recorded_for_local_copy",
          "retrieved_at": null,
          "sha256": "f244aa85f253072cf32c643184fef756db383cebc549dec865f193744d09ac6d",
          "size_bytes": 1356061,
          "source_url": "https://ladsweb.modaps.eosdis.nasa.gov/archive/allData/61/MYD14A1/2023/073/MYD14A1.A2023073.h26v06.061.2023082000920.hdf"
        },
        {
          "observed_end": "2023-03-29T23:59:59Z",
          "observed_start": "2023-03-22T00:00:00Z",
          "provider_checksum": null,
          "provider_object_id": "MYD14A1.A2023081.h26v06.061.2023090032802.hdf",
          "retrieval_timestamp_status": "not_recorded_for_local_copy",
          "retrieved_at": null,
          "sha256": "afd75210e57c4af74ac7e4bef58a48c3010c388426092756b737ce3fce1669be",
          "size_bytes": 1375577,
          "source_url": "https://ladsweb.modaps.eosdis.nasa.gov/archive/allData/61/MYD14A1/2023/081/MYD14A1.A2023081.h26v06.061.2023090032802.hdf"
        },
        {
          "observed_end": "2023-04-06T23:59:59Z",
          "observed_start": "2023-03-30T00:00:00Z",
          "provider_checksum": null,
          "provider_object_id": "MYD14A1.A2023089.h26v06.061.2023100002616.hdf",
          "retrieval_timestamp_status": "not_recorded_for_local_copy",
          "retrieved_at": null,
          "sha256": "11b5f3598467bb73cd171d909f2ba7912767d31bbf49c7b461d48311805361d0",
          "size_bytes": 1374557,
          "source_url": "https://ladsweb.modaps.eosdis.nasa.gov/archive/allData/61/MYD14A1/2023/089/MYD14A1.A2023089.h26v06.061.2023100002616.hdf"
        }
      ],
      "short_name": "MYD14A1",
      "source_url": "https://www.earthdata.nasa.gov/data/catalog/lpcloud-myd14a1-061",
      "stream": "science_mask",
      "version": "Collection 6.1"
    },
    {
      "nominal_resolution_m": 1000,
      "platform": "Suomi-NPP",
      "product_guide_url": "https://viirsland.gsfc.nasa.gov/PDF/VIIRS_activefire_User_Guide.pdf",
      "product_id": "vnp14a1_002_suomi_npp",
      "provider_objects": [
        {
          "observed_end": "2023-03-01T23:59:59Z",
          "observed_start": "2023-03-01T00:00:00Z",
          "provider_checksum": null,
          "provider_object_id": "VNP14A1.A2023060.h26v06.002.2023101003005.h5",
          "retrieval_timestamp_status": "not_recorded_for_local_copy",
          "retrieved_at": null,
          "sha256": "163912f1f4be591da6f0a9a7b8741f338115ddfaf23881a9668080f965383597",
          "size_bytes": 200146,
          "source_url": "https://ladsweb.modaps.eosdis.nasa.gov/archive/allData/5200/VNP14A1/2023/060/VNP14A1.A2023060.h26v06.002.2023101003005.h5"
        },
        {
          "observed_end": "2023-03-02T23:59:59Z",
          "observed_start": "2023-03-02T00:00:00Z",
          "provider_checksum": null,
          "provider_object_id": "VNP14A1.A2023061.h26v06.002.2023101020358.h5",
          "retrieval_timestamp_status": "not_recorded_for_local_copy",
          "retrieved_at": null,
          "sha256": "38f7184998107697640c3e8c3bd736f1244e8b90724e2656677bfac3a717eb18",
          "size_bytes": 214586,
          "source_url": "https://ladsweb.modaps.eosdis.nasa.gov/archive/allData/5200/VNP14A1/2023/061/VNP14A1.A2023061.h26v06.002.2023101020358.h5"
        },
        {
          "observed_end": "2023-03-03T23:59:59Z",
          "observed_start": "2023-03-03T00:00:00Z",
          "provider_checksum": null,
          "provider_object_id": "VNP14A1.A2023062.h26v06.002.2023101035505.h5",
          "retrieval_timestamp_status": "not_recorded_for_local_copy",
          "retrieved_at": null,